<?xml version="1.0" encoding="UTF-8"?>
<!--

 * Hide in edit mode : If some codelist needs to be hidden
 in edit mode, the hideInEditMode attribute could be added
 to any entries.

 eg.
	<entry hideInEditMode="true">

 This will restrict the number of available entries for end
 user editors and keep all records ISO compatible when using
 codelist (eg. harvested records could use codelist hidden
 in local node and needs to be displayed in view mode).

 By default, this attribute is not used.

 * editorMode attribute allows to configure the editor form field.

 * - not set -: simple combo box
 * radio : radio button in one line
 * radio_linebreak : radio button with line break
 * radio_withdesc : radion button with line break and codelist entry description
 * select : select box with size set to the number of items if lower than 7 entries.

-->
<codelists xmlns:xsi="http://www.w3.org/2001/XMLSchema-instance"
           xmlns:cat="http://standards.iso.org/iso/19115/-3/cat/1.0"
           xmlns:cit="http://standards.iso.org/iso/19115/-3/cit/2.0"
           xmlns:gcx="http://standards.iso.org/iso/19115/-3/gcx/1.0"
           xmlns:gex="http://standards.iso.org/iso/19115/-3/gex/1.0"
           xmlns:lan="http://standards.iso.org/iso/19115/-3/lan/1.0"
           xmlns:srv="http://standards.iso.org/iso/19115/-3/srv/2.1"
           xmlns:mas="http://standards.iso.org/iso/19115/-3/mas/1.0"
           xmlns:mcc="http://standards.iso.org/iso/19115/-3/mcc/1.0"
           xmlns:mco="http://standards.iso.org/iso/19115/-3/mco/1.0"
           xmlns:mda="http://standards.iso.org/iso/19115/-3/mda/1.0"
           xmlns:mdb="http://standards.iso.org/iso/19115/-3/mdb/2.0"
           xmlns:mds="http://standards.iso.org/iso/19115/-3/mds/2.0"
           xmlns:reg="http://standards.iso.org/iso/19135/-2/reg/1.0"
           xmlns:mdt="http://standards.iso.org/iso/19115/-3/mdt/2.0"
           xmlns:mex="http://standards.iso.org/iso/19115/-3/mex/1.0"
           xmlns:mmi="http://standards.iso.org/iso/19115/-3/mmi/1.0"
           xmlns:mpc="http://standards.iso.org/iso/19115/-3/mpc/1.0"
           xmlns:mrc="http://standards.iso.org/iso/19115/-3/mrc/2.0"
           xmlns:mrd="http://standards.iso.org/iso/19115/-3/mrd/1.0"
           xmlns:mri="http://standards.iso.org/iso/19115/-3/mri/1.0"
           xmlns:mrl="http://standards.iso.org/iso/19115/-3/mrl/2.0"
           xmlns:mrs="http://standards.iso.org/iso/19115/-3/mrs/1.0"
           xmlns:msr="http://standards.iso.org/iso/19115/-3/msr/2.0"
           xmlns:mdq="http://standards.iso.org/iso/19157/-2/mdq/1.0"
           xmlns:mac="http://standards.iso.org/iso/19115/-3/mac/2.0"
           xmlns:gco="http://standards.iso.org/iso/19115/-3/gco/1.0"
           xmlns:gml="http://www.opengis.net/gml/3.2"
           xmlns:xlink="http://www.w3.org/1999/xlink"
           xsi:noNamespaceSchemaLocation="../../../../../../../schema-labels.xsd">


  <codelist name="cit:CI_TelephoneTypeCode">
    <entry>
      <code>voice</code>
      <label>Voice</label>
      <description>Telephone provides voice service</description>
    </entry>
    <entry>
      <code>facsimilie</code>
      <label>Facsimilie</label>
      <description>Telephone provides facsimilie service</description>
    </entry>
    <entry>
      <code>sms</code>
      <label>SMS</label>
      <description>Telephone provides sms service</description>
    </entry>
  </codelist>
  <codelist name="cit:CI_DateTypeCode">
    <entry>
      <code>creation</code>
      <label>Creation</label>
      <description>Date identifies when the resource was brought into
        existence
      </description>
    </entry>
    <entry>
      <code>publication</code>
      <label>Publication</label>
      <description>Date identifies when the resource was issued</description>
    </entry>
    <entry>
      <code>revision</code>
      <label>Revision</label>
      <description>Date identifies when the resource was examined or re-examined
        and improved or amended
      </description>
    </entry>
    <entry>
      <code>expiry</code>
      <label>Expiry</label>
      <description>Date identifies when the resource expires</description>
    </entry>
    <entry>
      <code>lastUpdate</code>
      <label>Last Update</label>
      <description>Date identifies when the resource was last updated
      </description>
    </entry>
    <entry>
      <code>lastRevision</code>
      <label>Last Revision</label>
      <description>Date identifies when the resource was last reviewed
      </description>
    </entry>
    <entry>
      <code>nextUpdate</code>
      <label>Next Update</label>
      <description>Date identifies when the resource will be next updated
      </description>
    </entry>
    <entry>
      <code>unavailable</code>
      <label>Unavailable</label>
      <description>Date identifies when the resource became not available or
        obtainable
      </description>
    </entry>
    <entry>
      <code>inForce</code>
      <label>In Force</label>
      <description>Date identifies when the resource became in force
      </description>
    </entry>
    <entry>
      <code>adopted</code>
      <label>Adopted</label>
      <description>Date identifies when the resource was adopted</description>
    </entry>
    <entry>
      <code>deprecated</code>
      <label>Deprecated</label>
      <description>Date identifies when the resource was deprecated
      </description>
    </entry>
    <entry>
      <code>superseded</code>
      <label>Superseded</label>
      <description>Date identifies when the resource was superseded or replaced
        by another resource
      </description>
    </entry>
    <entry>
      <code>validityBegins</code>
      <label>Validity Begins</label>
      <description>Date identifies when the resource is considered to be valid
      </description>
    </entry>
    <entry>
      <code>validityExpires</code>
      <label>Validity Expires</label>
      <description>Date identifies when the resource is no longer considered to
        be valid
      </description>
    </entry>
    <entry>
      <code>released</code>
      <label>Released</label>
      <description>Date identifies when the resource shall be released for
        public access
      </description>
    </entry>
    <entry>
      <code>distribution</code>
      <label>Distribution</label>
      <description>Date identifies when an instance of the resource was
        distributed
      </description>
    </entry>
  </codelist>
  <codelist name="cit:CI_OnLineFunctionCode" alias="function">
    <entry>
      <code>download</code>
      <label>Download</label>
      <description>Online instructions for transferring data from one storage
        device or system to another
      </description>
    </entry>
    <entry>
      <code>information</code>
      <label>Information</label>
      <description>Online information about the resource</description>
    </entry>
    <entry>
      <code>offlineAccess</code>
      <label>Offline access</label>
      <description>Online instructions for requesting the resource from the
        provider
      </description>
    </entry>
    <entry>
      <code>order</code>
      <label>Order</label>
      <description>Online order process for obtening the resource</description>
    </entry>
    <entry>
      <code>search</code>
      <label>Search</label>
      <description>Online search interface for seeking out information about the
        resource
      </description>
    </entry>
    <entry>
      <code>completeMetadata</code>
      <label>Complete Metadata</label>
      <description>Complete metadata provided</description>
    </entry>
    <entry>
      <code>doi</code>
      <label>Digital Object Identifier (DOI)</label>
      <description></description>
    </entry>
    <entry>
      <code>browseGraphic</code>
      <label>Browse Graphic</label>
      <description>Browse Graphic provided</description>
    </entry>
    <entry>
      <code>upload</code>
      <label>Upload</label>
      <description>Upload service provided</description>
    </entry>
    <entry>
      <code>emailService</code>
      <label>Email Service</label>
      <description>Email service provided</description>
    </entry>
    <entry>
      <code>browsing</code>
      <label>Browsing</label>
      <description>Online browsing provided</description>
    </entry>
    <entry>
      <code>fileAccess</code>
      <label>Access File</label>
      <description>Online file access provided</description>
    </entry>
  </codelist>
  <codelist name="cit:CI_PresentationFormCode">
    <entry>
      <code>documentDigital</code>
      <label>Digital document</label>
      <description>Digital representation of a primarily textual item (can
        contain illustrations also)
      </description>
    </entry>
    <entry>
      <code>imageDigital</code>
      <label>Digital image</label>
      <description>Likeness of natural or man-made features, objects, and
        activities acquired through the sensing of visual or any other segment
        of the electromagnetic spectrum by sensors, such as thermal infrared,
        and high resolution radar and stored in digital format
      </description>
    </entry>
    <entry>
      <code>documentHardcopy</code>
      <label>Hardcopy document</label>
      <description>Representation of a primarily textual item (can contain
        illustrations also) on paper, photograhic material, or other media
      </description>
    </entry>
    <entry>
      <code>imageHardcopy</code>
      <label>Hardcopy image</label>
      <description>Likeness of natural or man-made features, objects, and
        activities acquired through the sensing of visual or any other segment
        of the electromagnetic spectrum by sensors, such as thermal infrared,
        and high resolution radar and reproduced on paper, photographic
        material, or other media for use directly by the human user
      </description>
    </entry>
    <entry>